<?xml version="1.0"?>
<?xml-stylesheet type="text/xsl" href="pdml2html.xsl"?>
<!-- You can find pdml2html.xsl in D:\Program Files\Wireshark or at http://anonsvn.wireshark.org/trunk/wireshark/pdml2html.xsl. -->
<pdml version="0" creator="wireshark/1.12.1" time="Sat Jul 25 19:37:48 2015" capture_file="E:\\DATAGRAPH\\PCAP\\ADRD\\com.ophone.MiniPlayerAND09b143b430e836c513279c0209b7229a4d29a18c.pcap">
<packet>
  <proto name="geninfo" pos="0" showname="General information" size="54">
    <field name="num" pos="0" show="1" showname="Number" value="1" size="54"/>
    <field name="len" pos="0" show="54" showname="Frame Length" value="36" size="54"/>
    <field name="caplen" pos="0" show="54" showname="Captured Length" value="36" size="54"/>
    <field name="timestamp" pos="0" show="Jul 25, 2015 16:53:07.322160000 中国标准时间" showname="Captured Time" value="1437814387.322160000" size="54"/>
  </proto>
  <proto name="frame" showname="Frame 1: 54 bytes on wire (432 bits), 54 bytes captured (432 bits)" size="54" pos="0">
    <field name="frame.encap_type" showname="Encapsulation type: Ethernet (1)" size="0" pos="0" show="1"/>
    <field name="frame.time" showname="Arrival Time: Jul 25, 2015 16:53:07.322160000 \xe4\xb8\xad\xe5\x9b\xbd\xe6\xa0\x87\xe5\x87\x86\xe6\x97\xb6\xe9\x97\xb4" size="0" pos="0" show="Jul 25, 2015 16:53:07.322160000 \xe4\xb8\xad\xe5\x9b\xbd\xe6\xa0\x87\xe5\x87\x86\xe6\x97\xb6\xe9\x97\xb4"/>
    <field name="frame.offset_shift" showname="Time shift for this packet: 0.000000000 seconds" size="0" pos="0" show="0.000000000"/>
    <field name="frame.time_epoch" showname="Epoch Time: 1437814387.322160000 seconds" size="0" pos="0" show="1437814387.322160000"/>
    <field name="frame.time_delta" showname="Time delta from previous captured frame: 0.000000000 seconds" size="0" pos="0" show="0.000000000"/>
    <field name="frame.time_delta_displayed" showname="Time delta from previous displayed frame: 0.000000000 seconds" size="0" pos="0" show="0.000000000"/>
    <field name="frame.time_relative" showname="Time since reference or first frame: 0.000000000 seconds" size="0" pos="0" show="0.000000000"/>
    <field name="frame.number" showname="Frame Number: 1" size="0" pos="0" show="1"/>
    <field name="frame.len" showname="Frame Length: 54 bytes (432 bits)" size="0" pos="0" show="54"/>
    <field name="frame.cap_len" showname="Capture Length: 54 bytes (432 bits)" size="0" pos="0" show="54"/>
    <field name="frame.marked" showname="Frame is marked: False" size="0" pos="0" show="0"/>
    <field name="frame.ignored" showname="Frame is ignored: False" size="0" pos="0" show="0"/>
    <field name="frame.protocols" showname="Protocols in frame: eth:ethertype:ip:tcp" size="0" pos="0" show="eth:ethertype:ip:tcp"/>
  </proto>
  <proto name="eth" showname="Ethernet II, Src: RealtekU_12:35:02 (52:54:00:12:35:02), Dst: CadmusCo_4f:2a:73 (08:00:27:4f:2a:73)" size="14" pos="0">
    <field name="eth.dst" showname="Destination: CadmusCo_4f:2a:73 (08:00:27:4f:2a:73)" size="6" pos="0" show="08:00:27:4f:2a:73" value="0800274f2a73">
      <field name="eth.dst_resolved" showname="Destination (resolved): CadmusCo_4f:2a:73" hide="yes" size="6" pos="0" show="CadmusCo_4f:2a:73" value="0800274f2a73"/>
      <field name="eth.addr" showname="Address: CadmusCo_4f:2a:73 (08:00:27:4f:2a:73)" size="6" pos="0" show="08:00:27:4f:2a:73" value="0800274f2a73"/>
      <field name="eth.addr_resolved" showname="Address (resolved): CadmusCo_4f:2a:73" hide="yes" size="6" pos="0" show="CadmusCo_4f:2a:73" value="0800274f2a73"/>
      <field name="eth.lg" showname=".... ..0. .... .... .... .... = LG bit: Globally unique address (factory default)" size="3" pos="0" show="0" value="0" unmaskedvalue="080027"/>
      <field name="eth.ig" showname=".... ...0 .... .... .... .... = IG bit: Individual address (unicast)" size="3" pos="0" show="0" value="0" unmaskedvalue="080027"/>
    </field>
    <field name="eth.src" showname="Source: RealtekU_12:35:02 (52:54:00:12:35:02)" size="6" pos="6" show="52:54:00:12:35:02" value="525400123502">
      <field name="eth.src_resolved" showname="Source (resolved): RealtekU_12:35:02" hide="yes" size="6" pos="6" show="RealtekU_12:35:02" value="525400123502"/>
      <field name="eth.addr" showname="Address: RealtekU_12:35:02 (52:54:00:12:35:02)" size="6" pos="6" show="52:54:00:12:35:02" value="525400123502"/>
      <field name="eth.addr_resolved" showname="Address (resolved): RealtekU_12:35:02" hide="yes" size="6" pos="6" show="RealtekU_12:35:02" value="525400123502"/>
      <field name="eth.lg" showname=".... ..1. .... .... .... .... = LG bit: Locally administered address (this is NOT the factory default)" size="3" pos="6" show="1" value="1" unmaskedvalue="525400"/>
      <field name="eth.ig" showname=".... ...0 .... .... .... .... = IG bit: Individual address (unicast)" size="3" pos="6" show="0" value="0" unmaskedvalue="525400"/>
    </field>
    <field name="eth.type" showname="Type: IP (0x0800)" size="2" pos="12" show="2048" value="0800"/>
  </proto>
  <proto name="ip" showname="Internet Protocol Version 4, Src: 219.145.184.56 (219.145.184.56), Dst: 10.0.3.15 (10.0.3.15)" size="20" pos="14">
    <field name="ip.version" showname="Version: 4" size="1" pos="14" show="4" value="45"/>
    <field name="ip.hdr_len" showname="Header Length: 20 bytes" size="1" pos="14" show="20" value="45"/>
    <field name="ip.dsfield" showname="Differentiated Services Field: 0x00 (DSCP 0x00: Default; ECN: 0x00: Not-ECT (Not ECN-Capable Transport))" size="1" pos="15" show="0" value="00">
      <field name="ip.dsfield.dscp" showname="0000 00.. = Differentiated Services Codepoint: Default (0x00)" size="1" pos="15" show="0" value="0" unmaskedvalue="00"/>
      <field name="ip.dsfield.ecn" showname=".... ..00 = Explicit Congestion Notification: Not-ECT (Not ECN-Capable Transport) (0x00)" size="1" pos="15" show="0" value="0" unmaskedvalue="00"/>
    </field>
    <field name="ip.len" showname="Total Length: 40" size="2" pos="16" show="40" value="0028"/>
    <field name="ip.id" showname="Identification: 0x0047 (71)" size="2" pos="18" show="71" value="0047"/>
    <field name="ip.flags" showname="Flags: 0x00" size="1" pos="20" show="0" value="00">
      <field name="ip.flags.rb" showname="0... .... = Reserved bit: Not set" size="1" pos="20" show="0" value="00"/>
      <field name="ip.flags.df" showname=".0.. .... = Don&apos;t fragment: Not set" size="1" pos="20" show="0" value="00"/>
      <field name="ip.flags.mf" showname="..0. .... = More fragments: Not set" size="1" pos="20" show="0" value="00"/>
    </field>
    <field name="ip.frag_offset" showname="Fragment offset: 0" size="2" pos="20" show="0" value="0000"/>
    <field name="ip.ttl" showname="Time to live: 64" size="1" pos="22" show="64" value="40"/>
    <field name="ip.proto" showname="Protocol: TCP (6)" size="1" pos="23" show="6" value="06"/>
    <field name="ip.checksum" showname="Header checksum: 0xd9b0 [validation disabled]" size="2" pos="24" show="55728" value="d9b0">
      <field name="ip.checksum_good" showname="Good: False" size="2" pos="24" show="0" value="d9b0"/>
      <field name="ip.checksum_bad" showname="Bad: False" size="2" pos="24" show="0" value="d9b0"/>
    </field>
    <field name="ip.src" showname="Source: 219.145.184.56 (219.145.184.56)" size="4" pos="26" show="219.145.184.56" value="db91b838"/>
    <field name="ip.addr" showname="Source or Destination Address: 219.145.184.56 (219.145.184.56)" hide="yes" size="4" pos="26" show="219.145.184.56" value="db91b838"/>
    <field name="ip.src_host" showname="Source Host: 219.145.184.56" hide="yes" size="4" pos="26" show="219.145.184.56" value="db91b838"/>
    <field name="ip.host" showname="Source or Destination Host: 219.145.184.56" hide="yes" size="4" pos="26" show="219.145.184.56" value="db91b838"/>
    <field name="ip.dst" showname="Destination: 10.0.3.15 (10.0.3.15)" size="4" pos="30" show="10.0.3.15" value="0a00030f"/>
    <field name="ip.addr" showname="Source or Destination Address: 10.0.3.15 (10.0.3.15)" hide="yes" size="4" pos="30" show="10.0.3.15" value="0a00030f"/>
    <field name="ip.dst_host" showname="Destination Host: 10.0.3.15" hide="yes" size="4" pos="30" show="10.0.3.15" value="0a00030f"/>
    <field name="ip.host" showname="Source or Destination Host: 10.0.3.15" hide="yes" size="4" pos="30" show="10.0.3.15" value="0a00030f"/>
    <field name="" show="Source GeoIP: Unknown" size="4" pos="26" value="db91b838"/>
    <field name="" show="Destination GeoIP: Unknown" size="4" pos="30" value="0a00030f"/>
  </proto>
  <proto name="tcp" showname="Transmission Control Protocol, Src Port: 80 (80), Dst Port: 60198 (60198), Seq: 1, Ack: 1, Len: 0" size="20" pos="34">
    <field name="tcp.srcport" showname="Source Port: 80 (80)" size="2" pos="34" show="80" value="0050"/>
    <field name="tcp.dstport" showname="Destination Port: 60198 (60198)" size="2" pos="36" show="60198" value="eb26"/>
    <field name="tcp.port" showname="Source or Destination Port: 80" hide="yes" size="2" pos="34" show="80" value="0050"/>
    <field name="tcp.port" showname="Source or Destination Port: 60198" hide="yes" size="2" pos="36" show="60198" value="eb26"/>
    <field name="tcp.stream" showname="Stream index: 0" size="0" pos="34" show="0"/>
    <field name="tcp.len" showname="TCP Segment Len: 0" size="1" pos="46" show="0" value="50"/>
    <field name="tcp.seq" showname="Sequence number: 1    (relative sequence number)" size="4" pos="38" show="1" value="00d4e71d"/>
    <field name="tcp.ack" showname="Acknowledgment number: 1    (relative ack number)" size="4" pos="42" show="1" value="f7594de4"/>
    <field name="tcp.hdr_len" showname="Header Length: 20 bytes" size="1" pos="46" show="20" value="50"/>
    <field name="tcp.flags" showname=".... 0000 0001 0001 = Flags: 0x011 (FIN, ACK)" size="2" pos="46" show="17" value="11" unmaskedvalue="5011">
      <field name="tcp.flags.res" showname="000. .... .... = Reserved: Not set" size="1" pos="46" show="0" value="0" unmaskedvalue="50"/>
      <field name="tcp.flags.ns" showname="...0 .... .... = Nonce: Not set" size="1" pos="46" show="0" value="0" unmaskedvalue="50"/>
      <field name="tcp.flags.cwr" showname=".... 0... .... = Congestion Window Reduced (CWR): Not set" size="1" pos="47" show="0" value="0" unmaskedvalue="11"/>
      <field name="tcp.flags.ecn" showname=".... .0.. .... = ECN-Echo: Not set" size="1" pos="47" show="0" value="0" unmaskedvalue="11"/>
      <field name="tcp.flags.urg" showname=".... ..0. .... = Urgent: Not set" size="1" pos="47" show="0" value="0" unmaskedvalue="11"/>
      <field name="tcp.flags.ack" showname=".... ...1 .... = Acknowledgment: Set" size="1" pos="47" show="1" value="1" unmaskedvalue="11"/>
      <field name="tcp.flags.push" showname=".... .... 0... = Push: Not set" size="1" pos="47" show="0" value="0" unmaskedvalue="11"/>
      <field name="tcp.flags.reset" showname=".... .... .0.. = Reset: Not set" size="1" pos="47" show="0" value="0" unmaskedvalue="11"/>
      <field name="tcp.flags.syn" showname=".... .... ..0. = Syn: Not set" size="1" pos="47" show="0" value="0" unmaskedvalue="11"/>
      <field name="tcp.flags.fin" showname=".... .... ...1 = Fin: Set" size="1" pos="47" show="1" value="1" unmaskedvalue="11">
        <field name="_ws.expert" showname="Expert Info (Chat/Sequence): Connection finish (FIN)" size="0" pos="47">
          <field name="tcp.connection.fin" showname="Connection finish (FIN)" size="0" pos="0" show="" value=""/>
          <field name="_ws.expert.message" showname="Message: Connection finish (FIN)" hide="yes" size="0" pos="0" show="Connection finish (FIN)"/>
          <field name="_ws.expert.severity" showname="Severity level: Chat" size="0" pos="0" show="2097152"/>
          <field name="_ws.expert.group" showname="Group: Sequence" size="0" pos="0" show="33554432"/>
        </field>
      </field>
    </field>
    <field name="tcp.window_size_value" showname="Window size value: 65535" size="2" pos="48" show="65535" value="ffff"/>
    <field name="tcp.window_size" showname="Calculated window size: 65535" size="2" pos="48" show="65535" value="ffff"/>
    <field name="tcp.window_size_scalefactor" showname="Window size scaling factor: -1 (unknown)" size="2" pos="48" show="-1" value="ffff"/>
    <field name="tcp.checksum" showname="Checksum: 0xf653 [validation disabled]" size="2" pos="50" show="63059" value="f653">
      <field name="tcp.checksum_good" showname="Good Checksum: False" size="2" pos="50" show="0" value="f653"/>
      <field name="tcp.checksum_bad" showname="Bad Checksum: False" size="2" pos="50" show="0" value="f653"/>
    </field>
    <field name="tcp.urgent_pointer" showname="Urgent pointer: 0" size="2" pos="52" show="0" value="0000"/>
  </proto>
</packet>


<packet>
  <proto name="geninfo" pos="0" showname="General information" size="54">
    <field name="num" pos="0" show="2" showname="Number" value="2" size="54"/>
    <field name="len" pos="0" show="54" showname="Frame Length" value="36" size="54"/>
    <field name="caplen" pos="0" show="54" showname="Captured Length" value="36" size="54"/>
    <field name="timestamp" pos="0" show="Jul 25, 2015 16:53:07.322166000 中国标准时间" showname="Captured Time" value="1437814387.322166000" size="54"/>
  </proto>
  <proto name="frame" showname="Frame 2: 54 bytes on wire (432 bits), 54 bytes captured (432 bits)" size="54" pos="0">
    <field name="frame.encap_type" showname="Encapsulation type: Ethernet (1)" size="0" pos="0" show="1"/>
    <field name="frame.time" showname="Arrival Time: Jul 25, 2015 16:53:07.322166000 \xe4\xb8\xad\xe5\x9b\xbd\xe6\xa0\x87\xe5\x87\x86\xe6\x97\xb6\xe9\x97\xb4" size="0" pos="0" show="Jul 25, 2015 16:53:07.322166000 \xe4\xb8\xad\xe5\x9b\xbd\xe6\xa0\x87\xe5\x87\x86\xe6\x97\xb6\xe9\x97\xb4"/>
    <field name="frame.offset_shift" showname="Time shift for this packet: 0.000000000 seconds" size="0" pos="0" show="0.000000000"/>
    <field name="frame.time_epoch" showname="Epoch Time: 1437814387.322166000 seconds" size="0" pos="0" show="1437814387.322166000"/>
    <field name="frame.time_delta" showname="Time delta from previous captured frame: 0.000006000 seconds" size="0" pos="0" show="0.000006000"/>
    <field name="frame.time_delta_displayed" showname="Time delta from previous displayed frame: 0.000006000 seconds" size="0" pos="0" show="0.000006000"/>
    <field name="frame.time_relative" showname="Time since reference or first frame: 0.000006000 seconds" size="0" pos="0" show="0.000006000"/>
    <field name="frame.number" showname="Frame Number: 2" size="0" pos="0" show="2"/>
    <field name="frame.len" showname="Frame Length: 54 bytes (432 bits)" size="0" pos="0" show="54"/>
    <field name="frame.cap_len" showname="Capture Length: 54 bytes (432 bits)" size="0" pos="0" show="54"/>
    <field name="frame.marked" showname="Frame is marked: False" size="0" pos="0" show="0"/>
    <field name="frame.ignored" showname="Frame is ignored: False" size="0" pos="0" show="0"/>
    <field name="frame.protocols" showname="Protocols in frame: eth:ethertype:ip:tcp" size="0" pos="0" show="eth:ethertype:ip:tcp"/>
  </proto>
  <proto name="eth" showname="Ethernet II, Src: RealtekU_12:35:02 (52:54:00:12:35:02), Dst: CadmusCo_4f:2a:73 (08:00:27:4f:2a:73)" size="14" pos="0">
    <field name="eth.dst" showname="Destination: CadmusCo_4f:2a:73 (08:00:27:4f:2a:73)" size="6" pos="0" show="08:00:27:4f:2a:73" value="0800274f2a73">
      <field name="eth.dst_resolved" showname="Destination (resolved): CadmusCo_4f:2a:73" hide="yes" size="6" pos="0" show="CadmusCo_4f:2a:73" value="0800274f2a73"/>
      <field name="eth.addr" showname="Address: CadmusCo_4f:2a:73 (08:00:27:4f:2a:73)" size="6" pos="0" show="08:00:27:4f:2a:73" value="0800274f2a73"/>
      <field name="eth.addr_resolved" showname="Address (resolved): CadmusCo_4f:2a:73" hide="yes" size="6" pos="0" show="CadmusCo_4f:2a:73" value="0800274f2a73"/>
      <field name="eth.lg" showname=".... ..0. .... .... .... .... = LG bit: Globally unique address (factory default)" size="3" pos="0" show="0" value="0" unmaskedvalue="080027"/>
      <field name="eth.ig" showname=".... ...0 .... .... .... .... = IG bit: Individual address (unicast)" size="3" pos="0" show="0" value="0" unmaskedvalue="080027"/>
    </field>
    <field name="eth.src" showname="Source: RealtekU_12:35:02 (52:54:00:12:35:02)" size="6" pos="6" show="52:54:00:12:35:02" value="525400123502">
      <field name="eth.src_resolved" showname="Source (resolved): RealtekU_12:35:02" hide="yes" size="6" pos="6" show="RealtekU_12:35:02" value="525400123502"/>
      <field name="eth.addr" showname="Address: RealtekU_12:35:02 (52:54:00:12:35:02)" size="6" pos="6" show="52:54:00:12:35:02" value="525400123502"/>
      <field name="eth.addr_resolved" showname="Address (resolved): RealtekU_12:35:02" hide="yes" size="6" pos="6" show="RealtekU_12:35:02" value="525400123502"/>
      <field name="eth.lg" showname=".... ..1. .... .... .... .... = LG bit: Locally administered address (this is NOT the factory default)" size="3" pos="6" show="1" value="1" unmaskedvalue="525400"/>
      <field name="eth.ig" showname=".... ...0 .... .... .... .... = IG bit: Individual address (unicast)" size="3" pos="6" show="0" value="0" unmaskedvalue="525400"/>
    </field>
    <field name="eth.type" showname="Type: IP (0x0800)" size="2" pos="12" show="2048" value="0800"/>
  </proto>
  <proto name="ip" showname="Internet Protocol Version 4, Src: 219.145.171.61 (219.145.171.61), Dst: 10.0.3.15 (10.0.3.15)" size="20" pos="14">
    <field name="ip.version" showname="Version: 4" size="1" pos="14" show="4" value="45"/>
    <field name="ip.hdr_len" showname="Header Length: 20 bytes" size="1" pos="14" show="20" value="45"/>
    <field name="ip.dsfield" showname="Differentiated Services Field: 0x00 (DSCP 0x00: Default; ECN: 0x00: Not-ECT (Not ECN-Capable Transport))" size="1" pos="15" show="0" value="00">
      <field name="ip.dsfield.dscp" showname="0000 00.. = Differentiated Services Codepoint: Default (0x00)" size="1" pos="15" show="0" value="0" unmaskedvalue="00"/>
      <field name="ip.dsfield.ecn" showname=".... ..00 = Explicit Congestion Notification: Not-ECT (Not ECN-Capable Transport) (0x00)" size="1" pos="15" show="0" value="0" unmaskedvalue="00"/>
    </field>
    <field name="ip.len" showname="Total Length: 40" size="2" pos="16" show="40" value="0028"/>
    <field name="ip.id" showname="Identification: 0x0048 (72)" size="2" pos="18" show="72" value="0048"/>
    <field name="ip.flags" showname="Flags: 0x00" size="1" pos="20" show="0" value="00">
      <field name="ip.flags.rb" showname="0... .... = Reserved bit: Not set" size="1" pos="20" show="0" value="00"/>
      <field name="ip.flags.df" showname=".0.. .... = Don&apos;t fragment: Not set" size="1" pos="20" show="0" value="00"/>
      <field name="ip.flags.mf" showname="..0. .... = More fragments: Not set" size="1" pos="20" show="0" value="00"/>
    </field>
    <field name="ip.frag_offset" showname="Fragment offset: 0" size="2" pos="20" show="0" value="0000"/>
    <field name="ip.ttl" showname="Time to live: 64" size="1" pos="22" show="64" value="40"/>
    <field name="ip.proto" showname="Protocol: TCP (6)" size="1" pos="23" show="6" value="06"/>
    <field name="ip.checksum" showname="Header checksum: 0xe6aa [validation disabled]" size="2" pos="24" show="59050" value="e6aa">
      <field name="ip.checksum_good" showname="Good: False" size="2" pos="24" show="0" value="e6aa"/>
      <field name="ip.checksum_bad" showname="Bad: False" size="2" pos="24" show="0" value="e6aa"/>
    </field>
    <field name="ip.src" showname="Source: 219.145.171.61 (219.145.171.61)" size="4" pos="26" show="219.145.171.61" value="db91ab3d"/>
    <field name="ip.addr" showname="Source or Destination Address: 219.145.171.61 (219.145.171.61)" hide="yes" size="4" pos="26" show="219.145.171.61" value="db91ab3d"/>
    <field name="ip.src_host" showname="Source Host: 219.145.171.61" hide="yes" size="4" pos="26" show="219.145.171.61" value="db91ab3d"/>
    <field name="ip.host" showname="Source or Destination Host: 219.145.171.61" hide="yes" size="4" pos="26" show="219.145.171.61" value="db91ab3d"/>
    <field name="ip.dst" showname="Destination: 10.0.3.15 (10.0.3.15)" size="4" pos="30" show="10.0.3.15" value="0a00030f"/>
    <field name="ip.addr" showname="Source or Destination Address: 10.0.3.15 (10.0.3.15)" hide="yes" size="4" pos="30" show="10.0.3.15" value="0a00030f"/>
    <field name="ip.dst_host" showname="Destination Host: 10.0.3.15" hide="yes" size="4" pos="30" show="10.0.3.15" value="0a00030f"/>
    <field name="ip.host" showname="Source or Destination Host: 10.0.3.15" hide="yes" size="4" pos="30" show="10.0.3.15" value="0a00030f"/>
    <field name="" show="Source GeoIP: Unknown" size="4" pos="26" value="db91ab3d"/>
    <field name="" show="Destination GeoIP: Unknown" size="4" pos="30" value="0a00030f"/>
  </proto>
  <proto name="tcp" showname="Transmission Control Protocol, Src Port: 80 (80), Dst Port: 42879 (42879), Seq: 1, Ack: 1, Len: 0" size="20" pos="34">
    <field name="tcp.srcport" showname="Source Port: 80 (80)" size="2" pos="34" show="80" value="0050"/>
    <field name="tcp.dstport" showname="Destination Port: 42879 (42879)" size="2" pos="36" show="42879" value="a77f"/>
    <field name="tcp.port" showname="Source or Destination Port: 80" hide="yes" size="2" pos="34" show="80" value="0050"/>
    <field name="tcp.port" showname="Source or Destination Port: 42879" hide="yes" size="2" pos="36" show="42879" value="a77f"/>
    <field name="tcp.stream" showname="Stream index: 1" size="0" pos="34" show="1"/>
    <field name="tcp.len" showname="TCP Segment Len: 0" size="1" pos="46" show="0" value="50"/>
    <field name="tcp.seq" showname="Sequence number: 1    (relative sequence number)" size="4" pos="38" show="1" value="00d3ecf6"/>
    <field name="tcp.ack" showname="Acknowledgment number: 1    (relative ack number)" size="4" pos="42" show="1" value="f313b52f"/>
    <field name="tcp.hdr_len" showname="Header Length: 20 bytes" size="1" pos="46" show="20" value="50"/>
    <field name="tcp.flags" showname=".... 0000 0001 0001 = Flags: 0x011 (FIN, ACK)" size="2" pos="46" show="17" value="11" unmaskedvalue="5011">
      <field name="tcp.flags.res" showname="000. .... .... = Reserved: Not set" size="1" pos="46" show="0" value="0" unmaskedvalue="50"/>
      <field name="tcp.flags.ns" showname="...0 .... .... = Nonce: Not set" size="1" pos="46" show="0" value="0" unmaskedvalue="50"/>
      <field name="tcp.flags.cwr" showname=".... 0... .... = Congestion Window Reduced (CWR): Not set" size="1" pos="47" show="0" value="0" unmaskedvalue="11"/>
      <field name="tcp.flags.ecn" showname=".... .0.. .... = ECN-Echo: Not set" size="1" pos="47" show="0" value="0" unmaskedvalue="11"/>
      <field name="tcp.flags.urg" showname=".... ..0. .... = Urgent: Not set" size="1" pos="47" show="0" value="0" unmaskedvalue="11"/>
      <field name="tcp.flags.ack" showname=".... ...1 .... = Acknowledgment: Set" size="1" pos="47" show="1" value="1" unmaskedvalue="11"/>
      <field name="tcp.flags.push" showname=".... .... 0... = Push: Not set" size="1" pos="47" show="0" value="0" unmaskedvalue="11"/>
      <field name="tcp.flags.reset" showname=".... .... .0.. = Reset: Not set" size="1" pos="47" show="0" value="0" unmaskedvalue="11"/>
      <field name="tcp.flags.syn" showname=".... .... ..0. = Syn: Not set" size="1" pos="47" show="0" value="0" unmaskedvalue="11"/>
      <field name="tcp.flags.fin" showname=".... .... ...1 = Fin: Set" size="1" pos="47" show="1" value="1" unmaskedvalue="11">
        <field name="_ws.expert" showname="Expert Info (Chat/Sequence): Connection finish (FIN)" size="0" pos="47">
          <field name="tcp.connection.fin" showname="Connection finish (FIN)" size="0" pos="0" show="" value=""/>
          <field name="_ws.expert.message" showname="Message: Connection finish (FIN)" hide="yes" size="0" pos="0" show="Connection finish (FIN)"/>
          <field name="_ws.expert.severity" showname="Severity level: Chat" size="0" pos="0" show="2097152"/>
          <field name="_ws.expert.group" showname="Group: Sequence" size="0" pos="0" show="33554432"/>
        </field>
      </field>
    </field>
    <field name="tcp.window_size_value" showname="Window size value: 65535" size="2" pos="48" show="65535" value="ffff"/>
    <field name="tcp.window_size" showname="Calculated window size: 65535" size="2" pos="48" show="65535" value="ffff"/>
    <field name="tcp.window_size_scalefactor" showname="Window size scaling factor: -1 (unknown)" size="2" pos="48" show="-1" value="ffff"/>
    <field name="tcp.checksum" showname="Checksum: 0xde18 [validation disabled]" size="2" pos="50" show="56856" value="de18">
      <field name="tcp.checksum_good" showname="Good Checksum: False" size="2" pos="50" show="0" value="de18"/>
      <field name="tcp.checksum_bad" showname="Bad Checksum: False" size="2" pos="50" show="0" value="de18"/>
    </field>
    <field name="tcp.urgent_pointer" showname="Urgent pointer: 0" size="2" pos="52" show="0" value="0000"/>
  </proto>
</packet>


<packet>
  <proto name="geninfo" pos="0" showname="General information" size="54">
    <field name="num" pos="0" show="3" showname="Number" value="3" size="54"/>
    <field name="len" pos="0" show="54" showname="Frame Length" value="36" size="54"/>
    <field name="caplen" pos="0" show="54" showname="Captured Length" value="36" size="54"/>
    <field name="timestamp" pos="0" show="Jul 25, 2015 16:53:07.322167000 中国标准时间" showname="Captured Time" value="1437814387.322167000" size="54"/>
  </proto>
  <proto name="frame" showname="Frame 3: 54 bytes on wire (432 bits), 54 bytes captured (432 bits)" size="54" pos="0">
    <field name="frame.encap_type" showname="Encapsulation type: Ethernet (1)" size="0" pos="0" show="1"/>
    <field name="frame.time" showname="Arrival Time: Jul 25, 2015 16:53:07.322167000 \xe4\xb8\xad\xe5\x9b\xbd\xe6\xa0\x87\xe5\x87\x86\xe6\x97\xb6\xe9\x97\xb4" size="0" pos="0" show="Jul 25, 2015 16:53:07.322167000 \xe4\xb8\xad\xe5\x9b\xbd\xe6\xa0\x87\xe5\x87\x86\xe6\x97\xb6\xe9\x97\xb4"/>
    <field name="frame.offset_shift" showname="Time shift for this packet: 0.000000000 seconds" size="0" pos="0" show="0.000000000"/>
    <field name="frame.time_epoch" showname="Epoch Time: 1437814387.322167000 seconds" size="0" pos="0" show="1437814387.322167000"/>
    <field name="frame.time_delta" showname="Time delta from previous captured frame: 0.000001000 seconds" size="0" pos="0" show="0.000001000"/>
    <field name="frame.time_delta_displayed" showname="Time delta from previous displayed frame: 0.000001000 seconds" size="0" pos="0" show="0.000001000"/>
    <field name="frame.time_relative" showname="Time since reference or first frame: 0.000007000 seconds" size="0" pos="0" show="0.000007000"/>
    <field name="frame.number" showname="Frame Number: 3" size="0" pos="0" show="3"/>
    <field name="frame.len" showname="Frame Length: 54 bytes (432 bits)" size="0" pos="0" show="54"/>
    <field name="frame.cap_len" showname="Capture Length: 54 bytes (432 bits)" size="0" pos="0" show="54"/>
    <field name="frame.marked" showname="Frame is marked: False" size="0" pos="0" show="0"/>
    <field name="frame.ignored" showname="Frame is ignored: False" size="0" pos="0" show="0"/>
    <field name="frame.protocols" showname="Protocols in frame: eth:ethertype:ip:tcp" size="0" pos="0" show="eth:ethertype:ip:tcp"/>
  </proto>
  <proto name="eth" showname="Ethernet II, Src: RealtekU_12:35:02 (52:54:00:12:35:02), Dst: CadmusCo_4f:2a:73 (08:00:27:4f:2a:73)" size="14" pos="0">
    <field name="eth.dst" showname="Destination: CadmusCo_4f:2a:73 (08:00:27:4f:2a:73)" size="6" pos="0" show="08:00:27:4f:2a:73" value="0800274f2a73">
      <field name="eth.dst_resolved" showname="Destination (resolved): CadmusCo_4f:2a:73" hide="yes" size="6" pos="0" show="CadmusCo_4f:2a:73" value="0800274f2a73"/>
      <field name="eth.addr" showname="Address: CadmusCo_4f:2a:73 (08:00:27:4f:2a:73)" size="6" pos="0" show="08:00:27:4f:2a:73" value="0800274f2a73"/>
      <field name="eth.addr_resolved" showname="Address (resolved): CadmusCo_4f:2a:73" hide="yes" size="6" pos="0" show="CadmusCo_4f:2a:73" value="0800274f2a73"/>
      <field name="eth.lg" showname=".... ..0. .... .... .... .... = LG bit: Globally unique address (factory default)" size="3" pos="0" show="0" value="0" unmaskedvalue="080027"/>
      <field name="eth.ig" showname=".... ...0 .... .... .... .... = IG bit: Individual address (unicast)" size="3" pos="0" show="0" value="0" unmaskedvalue="080027"/>
    </field>
    <field name="eth.src" showname="Source: RealtekU_12:35:02 (52:54:00:12:35:02)" size="6" pos="6" show="52:54:00:12:35:02" value="525400123502">
      <field name="eth.src_resolved" showname="Source (resolved): RealtekU_12:35:02" hide="yes" size="6" pos="6" show="RealtekU_12:35:02" value="525400123502"/>
      <field name="eth.addr" showname="Address: RealtekU_12:35:02 (52:54:00:12:35:02)" size="6" pos="6" show="52:54:00:12:35:02" value="525400123502"/>
      <field name="eth.addr_resolved" showname="Address (resolved): RealtekU_12:35:02" hide="yes" size="6" pos="6" show="RealtekU_12:35:02" value="525400123502"/>
      <field name="eth.lg" showname=".... ..1. .... .... .... .... = LG bit: Locally administered address (this is NOT the factory default)" size="3" pos="6" show="1" value="1" unmaskedvalue="525400"/>
      <field name="eth.ig" showname=".... ...0 .... .... .... .... = IG bit: Individual address (unicast)" size="3" pos="6" show="0" value="0" unmaskedvalue="525400"/>
    </field>
    <field name="eth.type" showname="Type: IP (0x0800)" size="2" pos="12" show="2048" value="0800"/>
  </proto>
  <proto name="ip" showname="Internet Protocol Version 4, Src: 124.116.133.40 (124.116.133.40), Dst: 10.0.3.15 (10.0.3.15)" size="20" pos="14">
    <field name="ip.version" showname="Version: 4" size="1" pos="14" show="4" value="45"/>
    <field name="ip.hdr_len" showname="Header Length: 20 bytes" size="1" pos="14" show="20" value="45"/>
    <field name="ip.dsfield" showname="Differentiated Services Field: 0x00 (DSCP 0x00: Default; ECN: 0x00: Not-ECT (Not ECN-Capable Transport))" size="1" pos="15" show="0" value="00">
      <field name="ip.dsfield.dscp" showname="0000 00.. = Differentiated Services Codepoint: Default (0x00)" size="1" pos="15" show="0" value="0" unmaskedvalue="00"/>
      <field name="ip.dsfield.ecn" showname=".... ..00 = Explicit Congestion Notification: Not-ECT (Not ECN-Capable Transport) (0x00)" size="1" pos="15" show="0" value="0" unmaskedvalue="00"/>
    </field>
    <field name="ip.len" showname="Total Length: 40" size="2" pos="16" show="40" value="0028"/>
    <field name="ip.id" showname="Identification: 0x0049 (73)" size="2" pos="18" show="73" value="0049"/>
    <field name="ip.flags" showname="Flags: 0x00" size="1" pos="20" show="0" value="00">
      <field name="ip.flags.rb" showname="0... .... = Reserved bit: Not set" size="1" pos="20" show="0" value="00"/>
      <field name="ip.flags.df" showname=".0.. .... = Don&apos;t fragment: Not set" size="1" pos="20" show="0" value="00"/>
      <field name="ip.flags.mf" showname="..0. .... = More fragments: Not set" size="1" pos="20" show="0" value="00"/>
    </field>
    <field name="ip.frag_offset" showname="Fragment offset: 0" size="2" pos="20" show="0" value="0000"/>
    <field name="ip.ttl" showname="Time to live: 64" size="1" pos="22" show="64" value="40"/>
    <field name="ip.proto" showname="Protocol: TCP (6)" size="1" pos="23" show="6" value="06"/>
    <field name="ip.checksum" showname="Header checksum: 0x6bdc [validation disabled]" size="2" pos="24" show="27612" value="6bdc">
      <field name="ip.checksum_good" showname="Good: False" size="2" pos="24" show="0" value="6bdc"/>
      <field name="ip.checksum_bad" showname="Bad: False" size="2" pos="24" show="0" value="6bdc"/>
    </field>
    <field name="ip.src" showname="Source: 124.116.133.40 (124.116.133.40)" size="4" pos="26" show="124.116.133.40" value="7c748528"/>
    <field name="ip.addr" showname="Source or Destination Address: 124.116.133.40 (124.116.133.40)" hide="yes" size="4" pos="26" show="124.116.133.40" value="7c748528"/>
    <field name="ip.src_host" showname="Source Host: 124.116.133.40" hide="yes" size="4" pos="26" show="124.116.133.40" value="7c748528"/>
    <field name="ip.host" showname="Source or Destination Host: 124.116.133.40" hide="yes" size="4" pos="26" show="124.116.133.40" value="7c748528"/>
    <field name="ip.dst" showname="Destination: 10.0.3.15 (10.0.3.15)" size="4" pos="30" show="10.0.3.15" value="0a00030f"/>
    <field name="ip.addr" showname="Source or Destination Address: 10.0.3.15 (10.0.3.15)" hide="yes" size="4" pos="30" show="10.0.3.15" value="0a00030f"/>
    <field name="ip.dst_host" showname="Destination Host: 10.0.3.15" hide="yes" size="4" pos="30" show="10.0.3.15" value="0a00030f"/>
    <field name="ip.host" showname="Source or Destination Host: 10.0.3.15" hide="yes" size="4" pos="30" show="10.0.3.15" value="0a00030f"/>
    <field name="" show="Source GeoIP: Unknown" size="4" pos="26" value="7c748528"/>
    <field name="" show="Destination GeoIP: Unknown" size="4" pos="30" value="0a00030f"/>
  </proto>
  <proto name="tcp" showname="Transmission Control Protocol, Src Port: 80 (80), Dst Port: 46322 (46322), Seq: 1, Ack: 1, Len: 0" size="20" pos="34">
    <field name="tcp.srcport" showname="Source Port: 80 (80)" size="2" pos="34" show="80" value="0050"/>
    <field name="tcp.dstport" showname="Destination Port: 46322 (46322)" size="2" pos="36" show="46322" value="b4f2"/>
    <field name="tcp.port" showname="Source or Destination Port: 80" hide="yes" size="2" pos="34" show="80" value="0050"/>
    <field name="tcp.port" showname="Source or Destination Port: 46322" hide="yes" size="2" pos="36" show="46322" value="b4f2"/>
    <field name="tcp.stream" showname="Stream index: 2" size="0" pos="34" show="2"/>
    <field name="tcp.len" showname="TCP Segment Len: 0" size="1" pos="46" show="0" value="50"/>
    <field name="tcp.seq" showname="Sequence number: 1    (relative sequence number)" size="4" pos="38" show="1" value="00d5e0fb"/>
    <field name="tcp.ack" showname="Acknowledgment number: 1    (relative ack number)" size="4" pos="42" show="1" value="03f602e5"/>
    <field name="tcp.hdr_len" showname="Header Length: 20 bytes" size="1" pos="46" show="20" value="50"/>
    <field name="tcp.flags" showname=".... 0000 0001 0001 = Flags: 0x011 (FIN, ACK)" size="2" pos="46" show="17" value="11" unmaskedvalue="5011">
      <field name="tcp.flags.res" showname="000. .... .... = Reserved: Not set" size="1" pos="46" show="0" value="0" unmaskedvalue="50"/>
      <field name="tcp.flags.ns" showname="...0 .... .... = Nonce: Not set" size="1" pos="46" show="0" value="0" unmaskedvalue="50"/>
      <field name="tcp.flags.cwr" showname=".... 0... .... = Congestion Window Reduced (CWR): Not set" size="1" pos="47" show="0" value="0" unmaskedvalue="11"/>
      <field name="tcp.flags.ecn" showname=".... .0.. .... = ECN-Echo: Not set" size="1" pos="47" show="0" value="0" unmaskedvalue="11"/>
      <field name="tcp.flags.urg" showname=".... ..0. .... = Urgent: Not set" size="1" pos="47" show="0" value="0" unmaskedvalue="11"/>
      <field name="tcp.flags.ack" showname=".... ...1 .... = Acknowledgment: Set" size="1" pos="47" show="1" value="1" unmaskedvalue="11"/>
      <field name="tcp.flags.push" showname=".... .... 0... = Push: Not set" size="1" pos="47" show="0" value="0" unmaskedvalue="11"/>
      <field name="tcp.flags.reset" showname=".... .... .0.. = Reset: Not set" size="1" pos="47" show="0" value="0" unmaskedvalue="11"/>
      <field name="tcp.flags.syn" showname=".... .... ..0. = Syn: Not set" size="1" pos="47" show="0" value="0" unmaskedvalue="11"/>
      <field name="tcp.flags.fin" showname=".... .... ...1 = Fin: Set" size="1" pos="47" show="1" value="1" unmaskedvalue="11">
        <field name="_ws.expert" showname="Expert Info (Chat/Sequence): Connection finish (FIN)" size="0" pos="47">
          <field name="tcp.connection.fin" showname="Connection finish (FIN)" size="0" pos="0" show="" value=""/>
          <field name="_ws.expert.message" showname="Message: Connection finish (FIN)" hide="yes" size="0" pos="0" show="Connection finish (FIN)"/>
          <field name="_ws.expert.severity" showname="Severity level: Chat" size="0" pos="0" show="2097152"/>
          <field name="_ws.expert.group" showname="Group: Sequence" size="0" pos="0" show="33554432"/>
        </field>
      </field>
    </field>
    <field name="tcp.window_size_value" showname="Window size value: 65535" size="2" pos="48" show="65535" value="ffff"/>
    <field name="tcp.window_size" showname="Calculated window size: 65535" size="2" pos="48" show="65535" value="ffff"/>
    <field name="tcp.window_size_scalefactor" showname="Window size scaling factor: -1 (unknown)" size="2" pos="48" show="-1" value="ffff"/>
    <field name="tcp.checksum" showname="Checksum: 0x033a [validation disabled]" size="2" pos="50" show="826" value="033a">
      <field name="tcp.checksum_good" showname="Good Checksum: False" size="2" pos="50" show="0" value="033a"/>
      <field name="tcp.checksum_bad" showname="Bad Checksum: False" size="2" pos="50" show="0" value="033a"/>
    </field>
    <field name="tcp.urgent_pointer" showname="Urgent pointer: 0" size="2" pos="52" show="0" value="0000"/>
  </proto>
</packet>


<packet>
  <proto name="geninfo" pos="0" showname="General information" size="76">
    <field name="num" pos="0" show="4" showname="Number" value="4" size="76"/>
    <field name="len" pos="0" show="76" showname="Frame Length" value="4c" size="76"/>
    <field name="caplen" pos="0" show="76" showname="Captured Length" value="4c" size="76"/>
    <field name="timestamp" pos="0" show="Jul 25, 2015 16:53:09.706398000 中国标准时间" showname="Captured Time" value="1437814389.706398000" size="76"/>
  </proto>
  <proto name="frame" showname="Frame 4: 76 bytes on wire (608 bits), 76 bytes captured (608 bits)" size="76" pos="0">
    <field name="frame.encap_type" showname="Encapsulation type: Ethernet (1)" size="0" pos="0" show="1"/>
    <field name="frame.time" showname="Arrival Time: Jul 25, 2015 16:53:09.706398000 \xe4\xb8\xad\xe5\x9b\xbd\xe6\xa0\x87\xe5\x87\x86\xe6\x97\xb6\xe9\x97\xb4" size="0" pos="0" show="Jul 25, 2015 16:53:09.706398000 \xe4\xb8\xad\xe5\x9b\xbd\xe6\xa0\x87\xe5\x87\x86\xe6\x97\xb6\xe9\x97\xb4"/>
    <field name="frame.offset_shift" showname="Time shift for this packet: 0.000000000 seconds" size="0" pos="0" show="0.000000000"/>
    <field name="frame.time_epoch" showname="Epoch Time: 1437814389.706398000 seconds" size="0" pos="0" show="1437814389.706398000"/>
    <field name="frame.time_delta" showname="Time delta from previous captured frame: 2.384231000 seconds" size="0" pos="0" show="2.384231000"/>
    <field name="frame.time_delta_displayed" showname="Time delta from previous displayed frame: 2.384231000 seconds" size="0" pos="0" show="2.384231000"/>
    <field name="frame.time_relative" showname="Time since reference or first frame: 2.384238000 seconds" size="0" pos="0" show="2.384238000"/>
    <field name="frame.number" showname="Frame Number: 4" size="0" pos="0" show="4"/>
    <field name="frame.len" showname="Frame Length: 76 bytes (608 bits)" size="0" pos="0" show="76"/>
    <field name="frame.cap_len" showname="Capture Length: 76 bytes (608 bits)" size="0" pos="0" show="76"/>
    <field name="frame.marked" showname="Frame is marked: False" size="0" pos="0" show="0"/>
